Date,Duration,Activity,Topics,AI,Age,Level,Num of Topics
2023-05-16 11:15:33,1.95,Listening,Water Resources and Management; Science and Scientific Discoveries; Future Plans and Goals; Volunteering and Community Service; Water Scarcity and Solutions; Fashion and Its Cultural Significance; Water Conservation; Fashion and Its Cultural Expression; Music and Performing Arts; Energy Efficiency and Conservation; Religious Practices and Traditions; Leadership and Its Qualities; Nature and Its Importance to Humanity; Entrepreneurship and Business,False,16,Intermediate,14
2022-11-21 01:04:06,1.48,Listening,Philosophical Questions and Debates; Nature and Its Importance to Humanity; Sports and Physical Activities; Global Warming and Climate Change; Water Conservation Strategies; Water Conservation; Tourism and Its Cultural Significance,False,47,Advanced,7
2022-02-15 08:43:05,1.97,Speaking,Global Sustainability Goals; Religion and Spirituality; Water Conservation Strategies; Volunteer Work and Its Rewards; Environmental Conservation; Shopping and Consumerism; Volunteerism and Its Social Impact; Childhood Memories; Global Sustainability Initiatives; Environment and Sustainability; Home and Accommodation; Public Transportation; Agricultural Practices and Sustainability; Philosophical Questions and Debates; Nature and Its Importance to Humanity,True,37,Intermediate,15
2024-10-24 07:37:29,3.94,Listening,Social Issues and Community; History and Historical Events; Family and Relationships; Art and Its Social Impact; Historical Context and Modern Relevance,True,50,Beginner,5
2023-01-17 16:54:26,3.21,Listening,Agriculture and Food Production; Agricultural Practices and Sustainability,True,35,Advanced,2
2023-05-15 14:03:58,2.91,Speaking,Historical Lessons and Modern Applications; Philosophy and Ethics; Religious Tolerance and Coexistence; Entrepreneurial Ventures and Their Impact; Social Media and Networking; Shopping and Consumerism; Tourism and Sustainable Development; Religious Diversity and Tolerance; Culture and Traditions,True,51,Intermediate,9
2024-05-26 19:33:26,0.77,Speaking,Public Transportation; Hobbies and Interests; History and Archaeology; Art and Its Therapeutic Value; Global Sustainability Goals; Agricultural Innovation and Technology,False,44,Intermediate,6
2022-11-26 14:39:46,2.16,Writing,Environmental Conservation; Entrepreneurial Ventures and Startups,False,28,Beginner,2
2022-11-17 19:25:20,2.47,Speaking,Volunteer Work and Social Impact; Historical Events and Their Impact; Fashion Trends and Sustainability; Water Management and Conservation; Language and Cultural Identity; Travel and Its Educational Value; Volunteer Opportunities and Social Change; Global Sustainability Goals; Tourism and Cultural Appreciation; Media and Entertainment; Fashion and Its Environmental Impact,True,47,Beginner,11
2023-03-10 07:55:53,2.86,Speaking,History and Archaeology; Historical Events and Their Lessons; Art and Creativity; Music and Performing Arts,True,27,Intermediate,4
2022-04-29 08:12:53,0.49,Listening,Religious Tolerance and Coexistence; Tourism and Economic Development; Water Resources and Their Management; Volunteerism and Its Social Impact; Nature and Wildlife; Daily Routine and Habits; Education and Learning; Language and Communication; Agricultural Practices for Sustainability; Cultural Heritage; Culture and Traditions; Tourism and Hospitality; Leadership and Influence; Fashion and Fashion Industry,True,56,Beginner,14
2023-04-16 18:59:17,1.51,Speaking,Fashion and Its Environmental Consequences; Hobbies and Interests; Tourism and Sustainable Development; Nature and Environmental Protection; Water Resources and Their Management; Fashion Trends and Sustainability; Art and Creativity; Energy Conservation and Renewable Energy; Nature Conservation and Biodiversity; Fashion and Fashion Industry; Philosophy and Ethics; Historical Lessons and Modern Applications,True,59,Advanced,12
